{
    "meta": {
        "exporter": "ida-json-exporter",
        "exporter_version": "1.0.0",
        "ida_version": "8.3",
        "timestamp": "2026-01-19T05:42:00Z",
        "idb_name": "malware_sample.idb",
        "idb_sha256": "d2f3a7c1b9e84f5d6c3e2a1b0f8e7d6c5b4a3928c7d6e5f4a3b2c1d0e9f8a7c1",
        "notes": "Sample export demonstrating schema structure"
    },
    "functions": [
        {
            "name": "sub_401000",
            "start": "0x401000",
            "end": "0x4010F0",
            "size": 240,
            "ordinal": 4198400,
            "demangled": "",
            "prototype": "int __cdecl sub_401000(char *buf, int size)",
            "blocks": [
                {
                    "id": "401000_bb0",
                    "start": "0x401000",
                    "end": "0x401020",
                    "insns": [
                        {
                            "ea": "0x401000",
                            "mnemonic": "push",
                            "operands": [
                                "ebp"
                            ],
                            "bytes": "55",
                            "xrefs_out": [],
                            "comments": "Function prologue"
                        },
                        {
                            "ea": "0x401001",
                            "mnemonic": "mov",
                            "operands": [
                                "ebp",
                                "esp"
                            ],
                            "bytes": "89E5",
                            "xrefs_out": [],
                            "comments": ""
                        },
                        {
                            "ea": "0x401003",
                            "mnemonic": "sub",
                            "operands": [
                                "esp",
                                "0x20"
                            ],
                            "bytes": "83EC20",
                            "xrefs_out": [],
                            "comments": "Allocate local vars"
                        },
                        {
                            "ea": "0x401006",
                            "mnemonic": "push",
                            "operands": [
                                "esi"
                            ],
                            "bytes": "56",
                            "xrefs_out": [],
                            "comments": ""
                        },
                        {
                            "ea": "0x401007",
                            "mnemonic": "push",
                            "operands": [
                                "edi"
                            ],
                            "bytes": "57",
                            "xrefs_out": [],
                            "comments": ""
                        },
                        {
                            "ea": "0x401008",
                            "mnemonic": "mov",
                            "operands": [
                                "eax",
                                "[ebp+8]"
                            ],
                            "bytes": "8B4508",
                            "xrefs_out": [],
                            "comments": "Load buf argument"
                        },
                        {
                            "ea": "0x40100B",
                            "mnemonic": "test",
                            "operands": [
                                "eax",
                                "eax"
                            ],
                            "bytes": "85C0",
                            "xrefs_out": [],
                            "comments": "NULL check"
                        },
                        {
                            "ea": "0x40100D",
                            "mnemonic": "jz",
                            "operands": [
                                "0x4010E0"
                            ],
                            "bytes": "0F84CD000000",
                            "xrefs_out": [
                                {
                                    "from": "0x40100D",
                                    "to": "0x4010E0",
                                    "type": "code_jump",
                                    "operand_index": 0,
                                    "insn_ea": "0x40100D",
                                    "is_flow": true
                                }
                            ],
                            "comments": "Jump if buf is NULL"
                        }
                    ],
                    "succs": [
                        "401000_bb1",
                        "401000_bb3"
                    ],
                    "preds": []
                },
                {
                    "id": "401000_bb1",
                    "start": "0x401013",
                    "end": "0x401040",
                    "insns": [
                        {
                            "ea": "0x401013",
                            "mnemonic": "mov",
                            "operands": [
                                "esi",
                                "eax"
                            ],
                            "bytes": "89C6",
                            "xrefs_out": [],
                            "comments": ""
                        },
                        {
                            "ea": "0x401015",
                            "mnemonic": "call",
                            "operands": [
                                "sub_402000"
                            ],
                            "bytes": "E8E60F0000",
                            "xrefs_out": [
                                {
                                    "from": "0x401015",
                                    "to": "0x402000",
                                    "type": "code_call",
                                    "operand_index": 0,
                                    "insn_ea": "0x401015",
                                    "is_flow": true
                                }
                            ],
                            "comments": "Call helper function"
                        },
                        {
                            "ea": "0x40101A",
                            "mnemonic": "mov",
                            "operands": [
                                "[ebp-4]",
                                "eax"
                            ],
                            "bytes": "8945FC",
                            "xrefs_out": [],
                            "comments": "Store result"
                        },
                        {
                            "ea": "0x40101D",
                            "mnemonic": "cmp",
                            "operands": [
                                "eax",
                                "0"
                            ],
                            "bytes": "83F800",
                            "xrefs_out": [],
                            "comments": ""
                        },
                        {
                            "ea": "0x401020",
                            "mnemonic": "jl",
                            "operands": [
                                "0x4010D0"
                            ],
                            "bytes": "7CAE",
                            "xrefs_out": [
                                {
                                    "from": "0x401020",
                                    "to": "0x4010D0",
                                    "type": "code_jump",
                                    "operand_index": 0,
                                    "insn_ea": "0x401020",
                                    "is_flow": true
                                }
                            ],
                            "comments": ""
                        }
                    ],
                    "succs": [
                        "401000_bb2",
                        "401000_bb4"
                    ],
                    "preds": [
                        "401000_bb0"
                    ]
                },
                {
                    "id": "401000_bb2",
                    "start": "0x401022",
                    "end": "0x401050",
                    "insns": [
                        {
                            "ea": "0x401022",
                            "mnemonic": "push",
                            "operands": [
                                "dword ptr [ebp+0Ch]"
                            ],
                            "bytes": "FF750C",
                            "xrefs_out": [],
                            "comments": "Push size argument"
                        },
                        {
                            "ea": "0x401025",
                            "mnemonic": "push",
                            "operands": [
                                "esi"
                            ],
                            "bytes": "56",
                            "xrefs_out": [],
                            "comments": "Push buf"
                        },
                        {
                            "ea": "0x401026",
                            "mnemonic": "call",
                            "operands": [
                                "memcpy"
                            ],
                            "bytes": "E8D5300000",
                            "xrefs_out": [
                                {
                                    "from": "0x401026",
                                    "to": "0x404100",
                                    "type": "code_call",
                                    "operand_index": 0,
                                    "insn_ea": "0x401026",
                                    "is_flow": true
                                }